<xsd:schema targetNamespace="http://venus.sod.asu.edu/WSRepository/xml" elementFormDefault="qualified" attributeFormDefault="unqualified">

    <xsd:element name="NationalParks" type="NationalParksType"/>
    <xsd:complexType name="NationalParksType">
        <xsd:sequence>
            <xsd:element name="NationalPark" type="NationalParkDetails" minOccurs="1" maxOccurs="unbounded"/>
        </xsd:sequence>
    </xsd:complexType>

    <xsd:complexType name="NationalParkDetails">
        <xsd:sequence>
            <xsd:element name="Name" type="xsd:string" minOccurs="1" maxOccurs="1"/>
            <xsd:element name="Phone" type="xsd:string" minOccurs="1" maxOccurs="unbounded"/>
            <xsd:element name="Address" type="AddressType" minOccurs="1" maxOccurs="1"/>
        </xsd:sequence>
    </xsd:complexType>

    <xsd:complexType name="AddressType">
        <xsd:sequence>
            <xsd:element name="Number" type="xsd:string" minOccurs="1" maxOccurs="1"/>
            <xsd:element name="Street" type="xsd:string" minOccurs="1" maxOccurs="1"/>
            <xsd:element name="City" type="xsd:string" minOccurs="1" maxOccurs="1"/>
            <xsd:element name="State" type="xsd:string" minOccurs="1" maxOccurs="1"/>
            <xsd:element name="Zip" type="xsd:string" minOccurs="1" maxOccurs="1"/>
        </xsd:sequence>
    </xsd:complexType>

</xsd:schema>
